Pin #,Theme,Page,Board,Media URL,Title,Description,Alt text,Destination link
1,princess,cover,Princess Coloring Pages for Kids,https://v3b.fal.media/files/b/0a95c5e1/Cv0j_yuo_kLjRUrNPXuco.jpg,Free Printable Princess Coloring Book for Kids — 20 Pages,"A personalized 20-page princess coloring storybook your little girl will love. Print at home, no waiting. See the free preview — your child becomes the hero of her own magical adventure! #princesscoloring #coloringpages #kidsactivities #printableforkids","Black and white princess coloring book cover with castle and tiara, printable for kids",https://www.magickcoloring.com/coloring-pages/princess-coloring-pages
2,princess,0,Princess Coloring Pages for Kids,https://v3b.fal.media/files/b/0a95c5e1/c6UhBFz7Yxf-4NsZbe3YZ.jpg,Princess Coloring Page — Free Printable for Little Girls,"Beautiful princess coloring page — part of a free 20-page storybook. High-resolution printable PDF, ages 3-8. Tap to see all the pages and print your favorites! #princesscoloring #printablecoloringpages #kidsactivity","Princess in a flowing gown standing in a garden, line art coloring page for kids",https://www.magickcoloring.com/coloring-pages/princess-coloring-pages
3,princess,4,Princess Coloring Pages for Kids,https://v3b.fal.media/files/b/0a95c5e1/6FtCAk31Ph-6MZiFJ0lsR.jpg,Fairy & Princess Coloring Pages — Printable Magic for Kids,"Enchanted fairy-tale coloring page from our princess adventure book. Print free, color together, make memories. 20 unique pages to explore! #fairycoloring #princesscoloring #kidscoloring","Princess meeting a friendly fairy in an enchanted forest, printable coloring page",https://www.magickcoloring.com/coloring-pages/fairy-coloring-pages
4,princess,9,Princess Coloring Pages for Kids,https://v3b.fal.media/files/b/0a95cd77/k5vya-jtIC7fAxA-jUCev.jpg,Your Daughter Becomes the Princess — Personalized Coloring Book,"What if your daughter was the hero of her own princess story? Create a one-of-a-kind 20-page coloring book starring HER name — only $5.90, instant PDF download, no shipping. See her face light up! #personalizedgift #princessbirthday #kidsgiftideas","Princess discovering glowing crystal diamonds in a magical cave, line drawing coloring page",https://www.magickcoloring.com/create?theme=princess
5,princess,14,Princess Coloring Pages for Kids,https://v3b.fal.media/files/b/0a95c5e2/uHPLNEC2BeTO94t0ClxLL.jpg,Princess & Dragon Coloring Page — Free Fairy Tale Printable,The princess finds a friendly dragon! Part of a free printable coloring book — 20 magical scenes. Great quiet activity for preschoolers and early elementary kids. #dragoncoloring #princesscoloring #printable,"Princess befriending a friendly dragon, coloring page line art for children",https://www.magickcoloring.com/coloring-pages/dragon-coloring-pages
6,princess,18,Princess Coloring Pages for Kids,https://v3b.fal.media/files/b/0a95cd77/2G691bv1Q-YhPcb3zxVv8.jpg,"Personalized Princess Storybook — Instant PDF, $5.90","Put your child's NAME in the story. 20 personalized coloring pages, high-res printable PDF delivered in minutes. Unique birthday gift, rainy day activity, screen-free fun. Preview free! #personalizedbook #princessparty #kidsbirthdaygift","Princess under a starry night sky with her dragon friend, personalized coloring book",https://www.magickcoloring.com/create?theme=princess
7,dinosaur,cover,Dinosaur Coloring Pages,https://v3b.fal.media/files/b/0a95c51c/_3QRds9UIEXOVl76fniEz.jpg,Dinosaur Coloring Book — Free Printable 20-Page Adventure,"Roar! A free 20-page dinosaur coloring storybook for kids. T-rex, triceratops, and more — all printable, all free to preview. Perfect for dino-obsessed preschoolers and kindergarteners! #dinosaurcoloring #dinosaursforkids #printablecoloring #kidsactivities","Dinosaur coloring book cover with T-rex and jungle background, printable for kids",https://www.magickcoloring.com/coloring-pages/dinosaur-coloring-pages
8,dinosaur,0,Dinosaur Coloring Pages,https://v3b.fal.media/files/b/0a95c51c/IQH4go8PLnnJb5lebuRpS.jpg,T-Rex Coloring Page — Free Printable Dinosaur for Kids,"Friendly T-Rex coloring page from our free 20-page dinosaur adventure book. High-res printable PDF, screen-free activity for ages 3-8. Click through to see all pages! #trex #dinosaurcoloring #printables","Friendly cartoon T-Rex standing in a jungle, black and white coloring page for kids",https://www.magickcoloring.com/coloring-pages/dinosaur-coloring-pages
9,dinosaur,4,Dinosaur Coloring Pages,https://v3b.fal.media/files/b/0a95c51c/eb-8nwJSTg2w0l8ii-JG1.jpg,Triceratops Coloring Page — Printable Dinosaur Fun,"Triceratops coloring page — part of a 20-page printable dinosaur storybook, free to preview. Simple bold lines perfect for younger kids. Tap to grab the full book! #triceratops #dinosaurcoloring #kidscoloring","Triceratops dinosaur with three horns, line art coloring page for children",https://www.magickcoloring.com/coloring-pages/dinosaur-coloring-pages
10,dinosaur,9,Dinosaur Coloring Pages,https://v3b.fal.media/files/b/0a95c51c/J4RnzCUBVGU4xbtHPmlzm.jpg,Personalized Dinosaur Coloring Book — Your Kid's Name in the Story,"Your little dino fan becomes the hero of a 20-page coloring adventure — with HIS name on every page. $5.90, instant PDF, printable at home. Best dinosaur birthday gift ever! #dinosaurparty #personalizedgift #dinosaurbirthday","Child dinosaur explorer discovering a palm tree jungle, coloring page line art",https://www.magickcoloring.com/create?theme=dinosaur
11,dinosaur,14,Dinosaur Coloring Pages,https://v3b.fal.media/files/b/0a95c51c/Ul-zU6HkyG3sszqwIv4J_.jpg,Baby Dinosaur Coloring Page — Free Printable for Preschoolers,Sweet baby dinosaur coloring page from a free 20-page printable storybook. Thick bold lines for little hands. Great for preschool and daycare activities. #babydinosaur #preschoolcoloring #printables,"Adorable baby dinosaur hatching, simple coloring page for preschoolers",https://www.magickcoloring.com/coloring-pages/dinosaur-coloring-pages
12,dinosaur,18,Dinosaur Coloring Pages,https://v3b.fal.media/files/b/0a95cd77/MoXie_cQhnOv2AsQeK5M0.jpg,Custom Dinosaur Storybook — Instant PDF Gift for $5.90,"Make your dinosaur-loving kid the star of his own coloring adventure. Type his name, get a 20-page personalized PDF in minutes. Screen-free, printable, unforgettable. Preview free! #dinosaurgift #birthdaygiftforboys #personalizedcoloring","Dinosaur child and T-Rex best friends under starry sky, personalized book page",https://www.magickcoloring.com/create?theme=dinosaur
13,space,cover,Space & Rocket Coloring Pages,https://v3b.fal.media/files/b/0a95c51d/LuZMUHT7MMZz6u58LL0HX.jpg,Space Coloring Book — Free 20-Page Printable Adventure,"Blast off! A free 20-page space coloring storybook featuring rockets, planets, and astronauts. Printable PDF, screen-free fun for space-loving kids ages 3-8. #spacecoloring #rocketcoloring #printableforkids #kidsactivities","Space coloring book cover with rocket, planets, and stars, printable for kids",https://www.magickcoloring.com/coloring-pages/space-coloring-pages
14,space,0,Space & Rocket Coloring Pages,https://v3b.fal.media/files/b/0a95cd77/7doZHqT6M9uoSR3iimwCU.jpg,Astronaut Coloring Page — Free Printable Space Adventure,Young astronaut looking out to the stars — free printable coloring page from a 20-page storybook. Great quiet-time activity for ages 3-8. Tap for the whole book! #astronaut #spacecoloring #kidsprintables,"Child astronaut looking at stars through a rocket window, coloring page line art",https://www.magickcoloring.com/coloring-pages/space-coloring-pages
15,space,4,Space & Rocket Coloring Pages,https://v3b.fal.media/files/b/0a95c51d/cHfKqeFlqpdKvP9kE6Ri3.jpg,Rocket Ship Coloring Page — Free Printable for Kids,"Rocket ship blasting off! Part of a free 20-page space coloring storybook. High-res printable PDF, perfect for rocket-obsessed preschoolers. #rocket #spacecoloringpages #kidsactivity","Cartoon rocket ship launching with flames, coloring page line art for children",https://www.magickcoloring.com/coloring-pages/rocket-coloring-pages
16,space,9,Space & Rocket Coloring Pages,https://v3b.fal.media/files/b/0a95c51d/7h4A-W3AuqPC6BiDuKGM3.jpg,Personalized Space Coloring Book — Your Child as Astronaut,"Imagine your child flying to Mars as the main character! 20-page personalized coloring storybook with their name on every page. $5.90, instant PDF download. Best space-themed gift! #spacegift #astronautparty #personalizedbook","Child astronaut floating in space near a planet, personalized coloring book page",https://www.magickcoloring.com/create?theme=space
17,space,14,Space & Rocket Coloring Pages,https://v3b.fal.media/files/b/0a95c51d/LKLsMCLsqzQRvz9kvGmeB.jpg,Planet & Alien Coloring Page — Printable Space Fun,"Meeting a friendly alien on a new planet! Free printable coloring page from our 20-page space adventure. Ages 3-8, bold lines, great for classrooms. #aliencoloring #spacecoloring #printableactivity","Child astronaut meeting a friendly alien on a colorful planet, coloring page",https://www.magickcoloring.com/coloring-pages/space-coloring-pages
18,space,18,Space & Rocket Coloring Pages,https://v3b.fal.media/files/b/0a95c51d/_KBJjGRllGWuKhat_wuei.jpg,"Custom Astronaut Book — Instant PDF, $5.90","A personalized space adventure starring YOUR child — 20 unique coloring pages, printable PDF, delivered in minutes. Unique birthday gift, zero shipping wait. Free preview! #personalizedgift #spacebirthday #kidsgift","Astronaut child pointing at a star constellation on a wall, personalized coloring page",https://www.magickcoloring.com/create?theme=space
19,unicorn,cover,Unicorn & Rainbow Coloring Pages,https://v3b.fal.media/files/b/0a95c51d/fdaKS_1q_72S1zThVp1kO.jpg,Unicorn Coloring Book — Free 20-Page Printable Magic,"A free 20-page unicorn coloring storybook full of rainbows, sparkles, and magic. Printable PDF, perfect for unicorn-obsessed girls ages 3-8. Tap to grab yours! #unicorncoloring #rainbowcoloring #printableforkids #kidsactivities","Unicorn coloring book cover with rainbow and stars, printable for little girls",https://www.magickcoloring.com/coloring-pages/unicorn-coloring-pages
20,unicorn,0,Unicorn & Rainbow Coloring Pages,https://v3b.fal.media/files/b/0a95c51d/VJQMbGj3OSnI1QoxKzr6B.jpg,Cute Unicorn Coloring Page — Free Printable for Girls,Adorable unicorn with a flowing mane — free printable coloring page from a 20-page storybook. Screen-free activity for ages 3-8. See all pages at the link! #cuteunicorn #unicorncoloring #printable,"Cute cartoon unicorn standing in a meadow, line art coloring page for children",https://www.magickcoloring.com/coloring-pages/unicorn-coloring-pages
21,unicorn,4,Unicorn & Rainbow Coloring Pages,https://v3b.fal.media/files/b/0a95c51d/lghBiouixb4m76O88DX3F.jpg,Rainbow & Unicorn Coloring Page — Printable Kids Activity,"Unicorn under a magical rainbow! Free coloring page from our 20-page unicorn adventure book. Print at home, color together. #rainbowcoloring #unicornprintable #kidscoloring","Unicorn standing under a rainbow with flowers and butterflies, coloring page",https://www.magickcoloring.com/coloring-pages/rainbow-coloring-pages
22,unicorn,9,Unicorn & Rainbow Coloring Pages,https://v3b.fal.media/files/b/0a95c51d/wjlsq8yP1IIgjzlTkvqoe.jpg,Personalized Unicorn Storybook — Your Daughter's Name in It,"Your little one becomes a unicorn rider in her own 20-page coloring adventure. HER name on every page, high-res printable PDF, $5.90, instant download. Unforgettable gift! #unicornbirthday #personalizedgift #giftforgirls","Girl riding a unicorn through a magical forest, personalized coloring book page",https://www.magickcoloring.com/create?theme=unicorn
23,unicorn,14,Unicorn & Rainbow Coloring Pages,https://v3b.fal.media/files/b/0a95c51d/XnqXfJH8gpNQiHShXmrlT.jpg,Unicorn Castle Coloring Page — Free Printable Magic,"Unicorn magical castle coloring page from a free 20-page storybook. Bold lines for little hands, beautiful details for bigger kids. #unicorncastle #unicorncoloring #printables","Unicorn in front of a magical fairy-tale castle, line art coloring page",https://www.magickcoloring.com/coloring-pages/unicorn-coloring-pages
24,unicorn,18,Unicorn & Rainbow Coloring Pages,https://v3b.fal.media/files/b/0a95c51d/zUZg4pP_14rQjohYG5PTj.jpg,"Custom Unicorn Coloring Book — Instant PDF Gift, $5.90","Make her the unicorn princess of her own story. Personalized 20-page coloring PDF, her name on every page, delivered in minutes. Perfect unique birthday gift for unicorn-loving girls. #unicornparty #birthdaygiftforgirls #personalizedcoloring","Unicorn and girl under twinkling star outlines, personalized coloring book page",https://www.magickcoloring.com/create?theme=unicorn
25,underwater,cover,Mermaid & Ocean Coloring Pages,https://v3b.fal.media/files/b/0a95c51d/r2-T4G3_c5XL4tqZv10R3.jpg,Mermaid Coloring Book — Free 20-Page Underwater Adventure,"Dive into a free 20-page mermaid and ocean coloring storybook! Dolphins, sea turtles, mermaids, and more. Printable PDF, ages 3-8. Free preview at the link! #mermaidcoloring #oceancoloring #printableforkids #kidsactivities","Mermaid coloring book cover with ocean and sea creatures, printable for kids",https://www.magickcoloring.com/coloring-pages/mermaid-coloring-pages
26,underwater,0,Mermaid & Ocean Coloring Pages,https://v3b.fal.media/files/b/0a95c51d/TVj-6_XX2jD2r3BDcnRHC.jpg,Ocean Coloring Page — Free Printable Underwater Scene,"Beautiful underwater ocean coloring page from our free 20-page storybook. High-res printable PDF, great for quiet activities and classrooms. #oceancoloring #underwater #kidsprintables","Underwater ocean scene with fish and seaweed, line art coloring page for kids",https://www.magickcoloring.com/coloring-pages/ocean-coloring-pages
27,underwater,4,Mermaid & Ocean Coloring Pages,https://v3b.fal.media/files/b/0a95cd77/qoUAkjuw43FVOYYyd8YD5.jpg,Dolphin Coloring Page — Free Printable for Kids,"Playful dolphin coloring page from a 20-page ocean adventure book. Printable PDF, perfect for sea-loving kids ages 3-8. #dolphincoloring #oceanpages #printable","Happy dolphin jumping out of the water, simple coloring page for children",https://www.magickcoloring.com/coloring-pages/dolphin-coloring-pages
28,underwater,9,Mermaid & Ocean Coloring Pages,https://v3b.fal.media/files/b/0a95cd77/k7MBC3JsLCOkr5MVOTph2.jpg,Personalized Mermaid Storybook — Your Child's Ocean Adventure,"Your little one becomes a mermaid exploring the ocean! 20-page personalized coloring PDF with her name. $5.90, instant download, printable at home. Unique birthday gift! #mermaidparty #personalizedgift #giftforgirls","Mermaid swimming with friendly sea creatures, personalized coloring book page",https://www.magickcoloring.com/create?theme=underwater
29,underwater,14,Mermaid & Ocean Coloring Pages,https://v3b.fal.media/files/b/0a95c51e/vq9Xd7ordsQrv6wkv4hWm.jpg,Underwater Castle Coloring Page — Free Printable,Magical underwater castle coloring page — part of a free 20-page ocean storybook. Bold fun lines for little artists. #underwatercastle #mermaidcoloring #printables,"Underwater castle with mermaid and sea creatures, line art coloring page",https://www.magickcoloring.com/coloring-pages/mermaid-coloring-pages
30,underwater,18,Mermaid & Ocean Coloring Pages,https://v3b.fal.media/files/b/0a95cd77/t1jab6qRWG0erGDLf4E4u.jpg,"Custom Ocean Adventure Book — Instant PDF, $5.90","A one-of-a-kind 20-page mermaid coloring book starring YOUR child. High-res PDF delivered in minutes, printable at home, no shipping. Free preview first! #personalizedbook #mermaidbirthday #kidsgift","Mermaid child reaching toward a sun outline above the waves, personalized coloring page",https://www.magickcoloring.com/create?theme=underwater